tag,image,link,name,date,title,comment
bbq,image_1.jpg,/blog/single,Lily Collins,"March 9, 2018","Gorgeous still-life.",1
bbq,image_2.jpg,/blog/single,Sam Claflin,"March 20, 2018","Motivating and simple to follow recipes. Beautiful and simple site design. Great writing.",5
bbq,image_3.jpg,/blog/single,Christian Cooke,"April 29, 2018","Beautiful travel photos.",8
bbq,image_4.jpg,/blog/single,Jaime Winstone,"May 6, 2018","Whole foods in local market.",3
noodle,image_5.jpg,/blog/single,Suki Winstone,"May 30, 2018","Unique sweets, sometimes with Asian ingredients.",11
noodle,image_6.jpg,/blog/single,Tamsin Egerton,"June 16, 2018","A hunter and forager's recipes for enjoying the fruits of the earth.",2
noodle,image_7.jpg,/blog/single,Jamie Beamish,"July 12, 2018","An L.A. food photographer's travels.",7
noodle,image_8.jpg,/blog/single,Ger Ryan,"August 25, 2018","She cooks. He devours. Together, they have some amazing food photography and recipes.",1
